{
  "artifact_type": "voice_pack.v1",
  "schema_version": "v1",
  "voice_pack_id": "givecare.voice.default.v1",
  "brand_id": "givecare.brand.core",
  "writer": {
    "repo": "agentcy-voice",
    "module": "agentcy-voice"
  },
  "name": "GiveCare default voice",
  "summary": "Warm, practical, dignity-first caregiver support voice.",
  "voice": {
    "tone": ["warm", "reassuring"],
    "style": ["plainspoken"],
    "audience": ["family caregivers"]
  },
  "constraints": {
    "dos": ["lead with empathy"],
    "donts": ["use fear-based urgency"]
  }
}
